comment,user_name,date
Seven needs only 7k for next milestone - what a great is day today for our Jungkookie!! Keep loving him he deserves all the love..,@Still_Tannies02,2025-03-21T18:33:46Z
Two milestones in one day! Such a success! I think social media will burn today. Congrats to JK and all his fans.,@maja9091,2025-03-21T18:19:45Z
I'm here for my most fav vocalist of all time.. Jungkook and his addictive song Seven which I can't get enough  of....,@Closer_To_Youu,2025-03-21T15:36:05Z
Let's go people. Let's reach this milestone,@chaedzamugoni8429,2025-03-21T14:51:37Z
"Jungkook lovers, please continue supporting him with positive vibes and refrain from leaving negative comments here <3",@mycutiepie9999,2025-03-21T12:01:12Z
"""Your voice feels like a dream—so mesmerizing and unforgettable!",@Rosalie-w2i,2025-03-21T11:45:22Z
This song is full of amazing vibes,@chaedzamugoni8429,2025-03-21T06:24:19Z
"I can’t get enough of Seven! No matter how many times I watch it, I’m still in awe of its beautiful melody and MV.",@JungkookScener,2025-03-21T01:53:31Z
Our 500M milestone poster is ready & waiting to be revealed... Less than 317K to go!,@ARMY_STREAM_TEAM,2025-03-20T21:03:36Z
His voice and rhythm is the only one.,@ako390,2025-03-20T12:59:32Z
LET'S BEAT 500M SOON ARMYS!!,@aaalizaa,2025-03-19T02:03:04Z
Here again 'cause I can't wait for a beautiful milestone poster...,@Still_Tannies070,2025-03-16T15:33:49Z
GOLDEN VOCALIST OF K-POP JUNGKOOK 🔥🔥🔥🔥🔥💜💜💜💜💜,@AbulKalam-j7u9z,2025-03-16T15:10:45Z
the best moment is the chorus 1:39,@MenWiś,2025-03-16T10:47:13Z
Get ready for another 'Seven' milestone poster reveal...,@ARMY_STREAM_TEAM,2025-03-16T07:18:22Z
Guyss plz stre@m dynamite and bst also it is soo close to its huge milestone,@meghnakb,2025-03-16T06:10:42Z
I hate bts but i still vibed on this song ❤,@Luv_katecafe,2025-03-15T12:18:08Z
Me vibing with the song but i understand the lyrics its bad,@GraceCandia-o9e,2025-03-13T13:04:43Z
JEON JUNGKOOK IS KING OF VOCAL.,@Jeonjungkookie-97-y2e,2025-03-13T07:28:30Z
His vocals are soothing ❤💜✨,@kunju-5423,2025-03-13T05:23:49Z
Seven is nearing to another milestone. Oh yes,@chaedzamugoni8429,2025-03-12T22:33:05Z
Let's go for more milestones,@chaedzamugoni8429,2025-03-11T19:01:52Z
Seven is really an amazing song to vibe to,@chaedzamugoni8429,2025-03-11T01:44:54Z
"Seven is part of Jung Kook's Golden, the first and foremost, released as a single. So the whole of Golden is the sum of its parts? With one precious voice as the through-line, giving Golden its own very special vibe.",@SusanMRS-be3dx,2025-03-09T18:10:16Z
"Spring is slowly coming, and with it the joyful rhythm of this song brings promises...",@maja9091,2025-03-09T11:43:09Z
song whose lyrics i have injected in veins,@sahilghuge5302,2025-03-07T14:33:49Z
i love this song and this is my first time watching this vid and did not expect that for the song lmaoo who pitched this and who approved! p.s it's never cute to have an ex try to wear you down like this IRL so I wish they chose a more fun concept. The funeral scene with Latto was v. funny tho!,@faiy8111,2025-03-05T23:30:02Z
Deeper than the ocean is~,@Abhi_Sunshine,2025-03-05T17:52:29Z
Why is this supposed to be the clean version but Latto swears in her verse?,@Comment4fun,2025-03-05T16:40:48Z
"Woah, this vibe... it's another level",@Pjm71099,2025-03-05T11:54:05Z
Still vibe in 2025,@MourineMariel,2025-03-04T20:46:21Z
our Jungkook's masterpiece Seven is close af to 500M yall this will be the 1st BTS solo song to achive that amazing milestone so let's do reach it before June! always with JK! and then we'll get seven to 1B next💜,@yeonjunsggum,2025-03-04T00:37:57Z
"Curious for the next milestone poster, cant wait to see five hundred million...",@Still_Tannies01,2025-03-03T17:40:27Z
I can't wait to see the five hundred million poster once we get this MV to the milestone,@chaedzamugoni8429,2025-03-03T15:41:01Z
Totally in love with JK’s vocals❤️‍🔥,@эльвираюсупова-ф3ч,2025-03-03T10:54:11Z
Spring beat 2000 - Furacão 2000...,@TheRealDigao,2025-02-28T00:33:18Z
El diavlo loco ya ni reggetonero,@NormaCalazacón,2025-02-28T00:06:56Z
"This song reminds me other from The Beatles ""Eigth days a week"", both gots the same concept to love all days. Fantastic",@jhonhernandezc283,2025-02-27T17:23:45Z
Show you what devotion is deeper than tye ocean is,@TakeTwo-z6g,2025-02-25T07:32:21Z
Annoying Shoe Palace music.,@heybrowhatup,2025-02-24T15:40:59Z
Uffff lyrics 🥵🙈😅,@Skthv_95,2025-02-23T21:20:07Z
When you finally understand the lyrics 💀💀,@Dragonpuppet_dreams1,2025-02-23T17:05:41Z
Justin bieber like vibe,@hari7709,2025-02-23T07:27:04Z
"Seven’ MV is a masterpiece! Jungkook’s vocals, visuals, and the whole production are just on another level. Can’t stop watching—this is pure art! 🔥",@4JKanBam,2025-02-22T07:10:42Z
such happy carefree vibes. ^^,@miraclewhip2384,2025-02-17T10:38:10Z
Muito fino o timbre rapazes,@Thebubassaur,2025-02-16T15:58:25Z
How are you Jungkook? I see your weverse Post. I miss you so much. And I love you Jungkook.,@Jeonjungkookie-97-y2e,2025-02-16T11:20:24Z
Jk's Weverse update have me in my feelings so the next best thing is to listen to his music😢😊miss u so much jungkookie😢,@TrudieJordan,2025-02-15T19:35:25Z
"My sweet sweet, sweet Angel, Jung Kook!!! My heart is squeezed with tenderness and love when I hear and see you!!! After your poignant and touching letter that you wrote on Weverse, my heart broke into many pieces from pain and joy at the same time!!! I'm crying with happiness that you wrote to us!!! We also miss you very, very much and are looking forward to counting the days and nights until your return home!!! Even in our dreams, we see you all together!!! But I know we have to be patient a little bit and all our dreams will come true!!! We will see and hear you all together again, and our Purple Universe will shine with all the colors of the rainbow!!!!My sweet, gentle and golden Jung Kook, please take care of yourself, don't worry your soul, be safe and never be sad!!! After all, the dark streak in life is always replaced by white, and after the most terrible storm, the brightest rainbow shines!!!Everything will be fine!!! May your military service fly by at the speed of light, and you will all return to us safely!!!With love!!!",@AsiyaAnastasiya,2025-02-15T12:34:46Z
"Мой милый милый, милый Ангел, Чонгук!!! Моё сердце сжимается от нежности и любви, когда я слышу и вижу тебя!!! После твоего пронзительного и трогательного письма, котое ты написал на Weverse моё сердце разбилось на множество осколков от боли и от радости одновременно!!! Я плачу от счастья, что ты нам написал!!! Мы тоже очень-очень сильно скучаем и с нетерпением считаем дни и ночи до вашего возвращения домой!!! Даже во сне мы видим вас всех вместе!!! Но я знаю, надо потерпеть совсем немного и все наши мечты сбудутся!!! Мы вновь увидим и услышим вас всех вместе и наша Фиолетовая Вселенная засияет всеми цветами радуги!!!!Мой милый, нежный и золотой Чонгук, береги пожалуйста себя, не береди себе душу, будь в безопасности и никогда не грусти!!! Ведь темная полоса в жизни всегда сменяется белой, а после самой грозной бури, сияет самая яркая радуга!!!Всё будет хорошо!!! Пусть ваша служба в армии пролетит со скоростью света, и вы к нам все вернётесь в целости и сохранности!!!С любовью!!!",@AsiyaAnastasiya,2025-02-15T11:44:22Z
Hino atemporal 🇧🇷💗,@THAYSCRISTINA-l6j,2025-02-14T23:43:24Z
I’m sorry but nothing is beating this and Latto is Chef’s kiss,@iamdokyeommysterymystery,2025-02-11T08:14:14Z
This gem is still catchy to this day,@chaedzamugoni8429,2025-02-11T03:41:48Z
Let's cross big milestone,@BoyWithLuv.1,2025-02-10T15:48:58Z
Seven is just too catchy!,@chaedzamugoni8429,2025-02-08T08:08:43Z
"I know this song was originally written for Justin Bieber, but does anyone hear JB in the background during the chorus?",@brokenham,2025-02-06T08:15:51Z
"Dear Jungkook, I really jealous of watching these shots in the MV, I really hope not to represent in the future, I really hurt every day of jealousy yet, and I cannot go beyond that,Please do not represent again in this way with girls,I am really not okay to see you represent with girls with this proximity and such scenes,I am very disturbed by clothes Latto the Disrespectful and indecent in the mv , I really like to explain what you want to tell me, dear Jungkook, without seeing Latto's clothes and hold you the girl's hand and approaching her, I really love you deeper than the ocean ,and This makes me jealous a lot when I see you approaching the girls,I really am jealous a lot, dear Jungkook, and I suffer every day , so please feel my heart and my big love ,my dear and my love Jungkook😭💔💔🤧",@ArmyForever-u7r,2025-02-04T17:25:23Z
DEEPER THAN THE OCEAN IS 🗣️,@bangtanboys7svn,2025-02-04T00:33:06Z
DEEPER THAN THE OCEAN ISSS😭😭😭🫦,@giuulims,2025-02-01T07:46:57Z
I’m still obsessed with this song. Jungkook has such a perfect energy and tone that makes this the most fun and engaging single. What a superstar 💜,@YayShadowPersona,2025-01-31T17:49:42Z
EVERY ORIGNAL HAD ITS CHEAP COPY BUT NOTHING CAN BEAT THE OG! SEVEN THE BEST EVER KPOP SOLOIST MV,@aashi001,2025-01-31T15:33:19Z
Minha música preferida de todos os tempossss😍🤣🤣🤣,@GiovannamoraesGuimaraesGuimara,2025-01-24T15:16:51Z
"""La gente nos llama los Beatles del siglo XXI es un honor increíble y me alegra oirlo pero aún asi quiero ser simplemente Bts en lugar de los Beatles del siglo XXI ,Bts como ningún otro ,quiero set algo nuevo y único ""....Jeon Jungkook",@antoniaquispe7012,2025-01-22T01:07:41Z
Seven is such a vibe ❤❤❤,@sadhanakale9934,2025-01-21T16:32:50Z
Deeper than the ocean is,@Wildflowerarmy_3,2025-01-19T10:15:41Z
He's vocals ❤💜,@Lil_Nia,2025-01-17T19:24:38Z
Any millennials here hear Craig David vibes?,@chateaux-capristovall2048,2025-01-15T15:27:44Z
Deeper than the ocean is,@Caier-7,2025-01-15T07:55:53Z
"It's 2025, I'm not a fan but I still vibe with this everyday...",@nenthecrazy,2025-01-14T06:25:59Z
"Naughty big muscled bunny..... Some can't show devotions  deeper than the ocean seven days a week, okay... We also need to recharge.. we don't have that stamina like yours haha!!!! 2025 🎉🎉🎉🎉 and still banging...",@NoOneButMe39,2025-01-13T03:13:32Z
"JK is one of the best vocalists in the world, a great dancer, an artist with a charismatic personality and simply a man with a big heart.",@maja9091,2025-01-11T08:42:34Z
Kind loving JK gave us New Year’s greetings on Weverse ~~ how sweet JK is!~~ we love JK ~ we miss JK~~ Let’s listen to SEVEN with heartwarming JK’s messages for us,@loveofmusic4854,2025-01-08T12:50:59Z
I love the way wheb he sings thursday friday saturdag on a high pitched voice same with ever hour and minut and second,@sanyasameer6746,2025-01-05T14:30:46Z
Absolutely in love with both versions of this song. Absolute masterpiece. Im loving that its giving Mr. PLANKTON vibes. Just perfect❤,@lavendertown5487,2025-01-01T14:33:47Z
The best k-pop song I have ever heard! SEVEN is so catchy and addictive. The MV is truly cinematic...,@AyeshaNiaz-e4x,2024-12-29T17:04:45Z
The best beat,@chikitahmoreno5927,2024-12-28T19:22:50Z
Again i came bruhh i just love this so much.. Anddd watching thie mv.. This is totally Jungkook's vibe.. If someday his gf got mad at him he'll for sure gonna do this 😂..,@Yoongi_bad_b1tch,2024-12-28T09:45:50Z
The lyrics of this song really speak to me.,@PaigeGreen-x9q,2024-12-28T09:09:07Z
Both of them look stunning and HIS VOCALSS??!!🔥🔥🔥,@SID_2511,2024-12-28T07:37:27Z
"It's impossible to listen to Christmas carols and songs throughout the holidays, so the positive vibes coming from JK's rhythmic songs will be a great interlude.",@maja9091,2024-12-23T10:18:40Z
"This song's so catchy, i'm singing it every hour, every minute, every second, seven days a week.",@KehukehuDevon,2024-12-20T08:35:50Z
I do't know but im in love with his golden vocals and our talanted maknae deserves the whole eorld😭,@PaudelShiva-bx8iw,2024-12-19T16:27:28Z
"It was wonderful with JK at Weverse live!!! 20 millions hearts were so happy at the presence of Jungkook. Thank you so much, Jungkook!! We love you SEVEN days a week.",@loveofmusic4854,2024-12-19T11:06:42Z
Who watched Jungkook's live on weverse?,@JeonRose7,2024-12-19T09:20:16Z
a pe rata winasa karapu rajapakshala iwarai help us our country is very beatiful,@thilakshipoornima,2024-12-19T09:10:12Z
I am enjoying your weverse Live. Thank you so much for your long live. Your looking so handsome and cute. I love you Jungkook. Stay safe and healthy Dear Jungkook.,@Jeonjungkookie-97-y2e,2024-12-19T08:44:55Z
Come here again after watching jk Vlive on weverse,@សុីវមួយសាឡាត់,2024-12-18T18:06:50Z
"Whoa, whoa, my baby Jungkook doing Weverse Live? Omg. Interesting, but also beautiful surprise baby Jungkook, I can only say, despite everything, if I missed you, I'm crying.",@guadalupearevalovalderrama0502,2024-12-18T16:07:04Z
Not a BTS fan but THATS VIBE😅😅,@Shidou士道,2024-12-15T16:52:56Z
Falling for the melody again..,@samihazaman2828,2024-12-14T10:44:02Z
We're approaching the milestone of five hundred million with ease,@chaedzamugoni8429,2024-12-14T07:26:43Z
Coming back because this Sang is still stuck in my head ( vocals/ visuals/ music video) it's deserve more guys,@Vidalavida5509,2024-12-10T21:52:07Z
"December SEVEN 2024 is still lovely with this song SEVEN. Jungkook’s singing voice is beautiful and I like ocean. My devotion to Golden Jungkook is deeper than the ocean. Whether it’s raining shining snowing, SEVEN Golden Jungkook is loved.  Stay warm.",@loveofmusic4854,2024-12-07T18:06:06Z
Annoying boyfriend?,@RajeswariJaisankar,2024-12-07T14:22:14Z
Keep playing. This MV should go to five hundred million. Imagine this being the 2nd male solo MV to get this milestone. So please play this song more here,@chaedzamugoni8429,2024-11-30T13:20:22Z
"To all the incredible ARMYs out there, you’re not just fans—you’re the heartbeat of a global family. Your love, dedication, and light transform the world into a more beautiful place, one song, one moment, and one connection at a time. You remind us that music is not just sound, but a bridge that brings souls together. Thank you for creating a space where kindness blooms and dreams find a home. You’re the reason so many people feel seen, loved, and inspired to keep going. Always remember, you are precious, just as you are.",@SunnyEnglishCafe,2024-11-29T11:57:03Z
"everything about jk is organic, he gets awards only bc of his success. Armys have not once voted jk for any award. May they get worst karma ever 😊.",@yhmfmelol,2024-11-27T04:54:56Z
Deep than the ocean is….:-),@mason7324,2024-11-27T01:02:37Z
Hannah bangs lyrics are way better 😻,@JadeBurstall,2024-11-26T08:16:41Z
"I believe in this man , actually i hate BTS and all kpop but this man is the most talented among other members, also he has an incredible vocals! Y'all I'm waiting for his next smash hit song , I think it will hit harder.",@DenverMichael-q8x,2024-11-25T21:10:59Z
This era full of wonderful vibes,@chaedzamugoni8429,2024-11-25T21:03:32Z
"We love SEVEN Golden Jungkook. Singing voice of Jungkook is very beautiful to my ears.  Jungkook can control his voice in various ways, in my opinion. Solo album GOLDEN has many songs and Jungkook expresses the feelings along with lyrics beautifully using his delicate singing voices. I love it.",@loveofmusic4854,2024-11-25T17:34:07Z
"Love this song, even though the girl's rap is terrible and ruins the vibe.",@leobonaldo1423,2024-11-24T14:01:51Z
"MAMA said “Asian solo artist with the most number one songs on a global music platform, proving to fans around the world that he is a ‘super powerful music king’ with his strong presence.”  CONGRATULATIONS JUNGKOOK Fans’ Choice Male Top 10” at the 2024 MAMA Awards!",@jandeeh,2024-11-22T11:31:04Z
Song ❤ lyrics 💀,@TannuSharma-ml5bv,2024-11-21T10:27:00Z
UK GARAGE VIBES,@stroberiblonde,2024-11-16T09:28:37Z
Deeper than the ocean is is crazyyy,@DaysWithKaleyYT,2024-11-14T23:11:12Z
Listening to this song again because it's still a bop and a vibe. Also honestly makes me wanna see kookie get a girl friend like in a big sister way lol. 🤣 Baby is all grown up and it makes me sad but at the same time glad and proud of him. 😊💜💜💜💜🥰😇,@lunerlilly,2024-11-12T15:13:57Z
"best song, so very catchy!",@JC-fw9bg,2024-11-11T20:47:26Z
"Golden Jungkook is beautiful wonderful powerful as JK is singing unwavering love. SEVEN days a week, we love Jungkook.",@loveofmusic4854,2024-11-10T13:34:43Z
"Monday Tuesday Wednesday Thursday Friday Saturday Sunday. SEVEN days a week, I listen to SEVEN GOLDEN Jungkook.  Devotion is deeper than ocean is. We love Jungkook. Let’s enjoy SEVEN today with unwavering support for JK.",@loveofmusic4854,2024-11-09T03:34:23Z
What a joyful melody eh,@Bangtan_Benavides,2024-11-08T23:47:33Z
"While jungkook was busy promoting his songs somebody was out there busy taking notes on main pop boy's every move, still failed to get any success",@Georgia-j5p6g,2024-11-05T23:11:36Z
"Happy anniversary, GOLDEN! You're a milestone in pop history.",@InternetUser37,2024-11-03T05:29:32Z
No one can beat My boy's Jimin and V's songs even this Junk food 😏😏😏😎,@abhih-st6ku,2024-11-02T11:11:49Z
eyyyyyy still November vibes,@rionnicejumawid,2024-11-02T00:30:30Z
"Como assim já faz um ano 😢, mds eu tô perdida no tempo",@evelly_sodrex,2024-11-01T03:17:16Z
Such a vibe,@wandz_c5736,2024-10-31T18:40:30Z
"A vibe dessa música é tao boa, obg Jk por essa obra prima !!!",@JosyMantovanni,2024-10-30T14:11:45Z
Those who after knowing the lyrics 💀,@marybleesy3352,2024-10-27T17:21:33Z
Tempo tempo mano velho quanto falta pra te ver jk,@madalenamelo7374,2024-10-26T19:47:02Z
Seven is The King. Still unbeatable even after so many new releases..,@MitaBrite,2024-10-26T11:37:05Z
Every beat of this song is filled with something interesting. Like MJ on seroids 😂,@grzegorzstrongowski9439,2024-10-25T15:12:23Z
"Seven has supernatural power, like it's from another dimension of the universe :-)",@SusanMRS-be3dx,2024-10-25T14:28:21Z
"All the awards that JK won for his hard work are still not enough to repay him for his music, wonderful vocals, sincere heart and smile.",@maja9091,2024-10-24T23:16:12Z
JUNGKOOK’s ‘SEVEN (feat. Latto)’ has now surpassed 2 BILLION Streams on Spotify! FIRST song by an Asian/K-pop Act to reach this milestone in the platform’s HISTORY,@Bangtan_world613,2024-10-23T18:01:08Z
JUNGKOOK’s ‘SEVEN (feat. Latto)’ has now surpassed 2 BILLION Streams on Spotify! FIRST song by an Asian/K-pop Act to reach this milestone in the platform’s HISTORY! It became the 4th fastest song in history to do so.,@bangtanbishx,2024-10-23T17:49:25Z
the lyrics bro,@YukiTheBrainrot,2024-10-23T13:23:11Z
Let's bring Seven to a higher milestone! Let's play harder,@chaedzamugoni8429,2024-10-22T17:55:54Z
"""Your artistry shines through in 'Seven'—a perfect blend of rhythm and soul!""💜💜💜💜💜❤❤❤",@Shine.universe1799,2024-10-21T10:05:50Z
"""JK's 'Seven' is an absolute masterpiece; the melody is captivating!""❤❤❤❤💜💜💜💜",@Shine.universe1799,2024-10-21T10:04:58Z
"I have always admired and will continue to admire this talented person. JK, your vocals are the best I've ever heard. Han Sohee and Latto are charming girls, who also break my heart...  with great love from Rus. Army",@phonghuynh2026,2024-10-15T14:20:05Z
"I'm so enjoy watching this mv, not only the song but the whole storyline in this mv just so interesting and of course jungkook and latto's vocals nailed it",@user-io6wh6of7o,2024-10-13T07:11:01Z
A man with the best vocals!,@chaedzamugoni8429,2024-10-12T08:48:27Z
"The song, the vocals, the video and jungkook, everything is perfect",@lofixly,2024-10-08T18:23:49Z
Jungkook’s voice is beautiful. Dancing is wonderful. Performance is powerful. Jungkook has brilliant vocals and many talents. Unwavering heart of love for ARMYs Fans is Jungkook,@loveofmusic4854,2024-10-07T09:52:12Z
"4 October 2024 (KST): Feeling nostalgic? It's now been 9 years since Jungkook released his cover of Adam Levine's 'Lost Stars' here on YT. If you've never heard/seen it before (it's a black screen video), now is the perfect time. Don't forget to wish it a Happy Anniversary. <3",@ARMY_STREAM_TEAM,2024-10-03T22:31:56Z
His vocals is amazing😭😭❤️‍🩹,@mariamamrtalat,2024-10-03T20:38:37Z
Jungkook>>>>>>whole universe,@Ranviaaran,2024-10-03T05:06:26Z
"The best vocal artist ""JUNGKOOK""",@Humayra-f7i,2024-10-01T15:49:38Z
Another record breaking song......the vocals are just worth dying for,@7-A-R-M-Y-7,2024-09-30T11:24:27Z
His vocals❤,@tryphostakhuboni1776,2024-09-28T15:28:50Z
"Jungkook's voice, the golden stone",@Sarah-b9q5q,2024-09-28T07:35:11Z
SEVEN is the song everyone can connect oneself with. SEVEN MV is the dramatic movie every element of our daily life is weaved into. Restaurant Train Laundromat Flooding Hurricane Rainstorm 911 Flowers Cars Strollers Many people on streets Buildings Funeral Human emotions Resurrecting Jungkook Holding hands Walking in the rain. All these elements of life are part of our lives. That is why SEVEN MV is loved so much by so many people. We love SEVEN. We love SEVEN MV. We love Jungkook.,@loveofmusic4854,2024-09-27T09:31:45Z
i like this song so much because the beat and singing and the dancing i feel i becoming a pop star someday :),@RalphRendelJacinto,2024-09-26T12:05:06Z
This sonis the vibe,@Tisoo-w1z,2024-09-24T21:07:40Z
Jungkook  you are the light of the group and your singing and dancing always touch our hearts your beauty and talent make you unforgettable btsupdate group NO. 118 members,@Shibuukookie,2024-09-23T18:54:19Z
"I AM STILL loving songs of love. JUNG KOOK is STILL singing SEVEN everyday every hour every minute every second for ARMY , the most beautiful and powerful name . Let’s go. Let’s enjoy SEVEN Golden Jungkook.",@loveofmusic4854,2024-09-22T11:33:05Z
I loved this song and it's vibes are awesome ❤😩,@bipasha_music_,2024-09-17T11:03:12Z
"I can never forget this song, it's engraved in my head. Jungkook, you are truly a talented and soulful vocalist out there. I love you.",@Ami-fam,2024-09-14T17:42:54Z
"1 week ago I didn’t know who JungKook is and randomly came across “Standing Next To You” .. and today I officially declare myself a JungKook stan 😭😍😭🥰 My my!! What a combination of talent, vocals, dancing, looks and that ATTITUDE🔥🔥 oh yes mmhmmm!!🥵 Been watching his solo performances and songs on repeat 😍💘😭🥵🔥",@Aquamerinee,2024-09-14T06:02:35Z
Deeper than the ocean is.....,@LMCAL-hx3jt,2024-09-07T20:22:00Z
*This song is so catchy and Yeah I'm still here* :),@vintage_okama,2024-09-07T16:12:56Z
This song is so catchy!!! I luv the acting and the MV is just awesome!!! I’ve bin streaming this song since it dropped n I’m so glad that it’s getting so much of recognition! Luv u Jungkook!,@JeonMafia_97,2024-09-07T07:48:05Z
This is so nostalgic...<3,@Aesthxeal,2024-09-05T19:56:57Z
"I love the song and all❤, but is it just me that understands all the lyrics the way it is NOT supposed to be understood??😂",@san_1234,2024-09-05T15:21:12Z
Less than 70 million to next milestone,@Still_Tannies03,2024-09-05T06:56:35Z
lol awful. 🤣,@JohnDavidHillman,2024-09-04T08:58:58Z
Vibe gostoso 😅😅,@Vlogsdeskincare,2024-09-03T22:10:56Z
Deeper than the ocean is......,@LMCAL-hx3jt,2024-09-03T00:21:31Z
"""Happy birthday to the king of K-pop, Jungkook! Wishing you a day as bright and amazing as you are!""Jungkook, you light up the world with your talent and smile. Here's to another year of sparkling success and happiness! Be happy On your special day and always, we celebrate YOU, Jungkook! Wishing you a birthday as unforgettable as your performances!"".Jungkook, may your birthday be filled with love, laughter, and all your favorite things. You deserve it all!.""Here's to another year of breaking records, stealing hearts, and shining bright, Jungkook! Happy birthday, our Golden Maknae!""",@ShabinaTanveer-z7t,2024-08-31T15:26:08Z
Its already 1 year this song.. I cannot  get this song outta my head....such a  catchy song love it 💜💜💜,@HumayraFarzana-cx3ru,2024-08-31T14:41:16Z
"Aw Jk tomorrow is your Birthday 🎂 happy birthday! Love you, hope you’re enjoying your day! I’m waiting for a weverse live.",@simplycrischannel,2024-08-31T13:13:26Z
Soo beatifull,@SoftVideolar-z4r,2024-08-29T19:16:00Z
I really love the vibe,@pinkxtan,2024-08-26T07:18:55Z
Titanic vibes 😂,@catgirlbot,2024-08-25T05:43:46Z
Deeper than the ocean is,@ARMY9YOUTUBE,2024-08-23T05:26:57Z
Geldimm ben Senamm ofofofoof mükemmel ya vibe>>>>>>>>>>>>>>>>>>>>,@Rubiess_Jensetter,2024-08-22T23:35:39Z
The best song I've ever had.such an art especially the chorus,@Celine_as_a_st4r,2024-08-14T16:16:05Z
